{
  "schema_version": "1.0.0",
  "proposal_id": "ca.sco.segment_500_plus.property_type_nonconforming_row_handling_policy_decision",
  "proposal_version": "1.0.0",
  "proposal_status": "PROPOSAL_ONLY_NOT_AUTHORIZED",
  "prepared_on": "2026-09-16",
  "jurisdiction": "CA",
  "source_id": "ca.sco.unclaimed_property.bulk",
  "source_segment_id": "ca.sco.unclaimed_property.bulk.500_plus",
  "base_state": {
    "branch": "m3-ca-sco-property-type-nonconforming-row-handling-proposal-review",
    "head_sha": "6ef0cbaed7536c61d00888644bc463d9894418f6",
    "head_ci_run": "35094679116",
    "handling_proposal_review_audit": "docs/archive/M3_CA_SCO_PROPERTY_TYPE_NONCONFORMING_ROW_HANDLING_PROPOSAL_REVIEW.md",
    "handling_proposal_review_decision": "PASS_WITH_MANDATORY_POLICY_DECISION_TIGHTENINGS",
    "source_format_diagnostic_class": "INDEPENDENT_PARSER_AGREES_FIELD_STRUCTURAL_MISMATCH"
  },
  "reviewed_evidence_boundary": {
    "examined_rows": 1,
    "strict_full_row_utf8_decode_succeeded": true,
    "strict_stdlib_csv_parse_succeeded": true,
    "canonical_column_count": 25,
    "stdlib_property_type_index": 1,
    "stdlib_projector_field_agreement": true,
    "agreed_field_failed_unchanged_regex": true,
    "exact_property_type_retained": false,
    "property_type_derivative_retained": false,
    "frequency_known": false,
    "cause_known": false,
    "source_intent_known": false
  },
  "mandatory_tightenings": {
    "T1_control_disposition_separate_from_source_continuation": true,
    "T2_metadata_defer_separate_from_real_row_quarantine": true,
    "T3_human_review_metadata_only_without_privacy_authorization": true,
    "T4_current_stop_behavior_preserved_until_explicit_approval": true,
    "T5_continuation_requires_completeness_audit_design": true,
    "T6_policy_selection_and_runtime_implementation_are_separate_gates": true
  },
  "unchanged_validation_contract": {
    "property_type_zero_based_index": 1,
    "regex": "^(?:[A-Z]{2}[0-9]{2}|ZZZZ)$",
    "trim_before_validation": false,
    "ascii_uppercase_before_validation": false,
    "unicode_normalization_before_validation": false,
    "alternate_token_acceptance": false,
    "parser_or_projector_change": false
  },
  "proposed_policy": {
    "policy_id": "WHOLE_SOURCE_STOP",
    "proposal_selection_status": "PROPOSED_FOR_HUMAN_REVIEW_NOT_AUTHORIZED",
    "rationale_codes": [
      "PRESERVES_CURRENT_FAIL_CLOSED_BEHAVIOR",
      "NO_SOURCE_CONTINUATION",
      "NO_REAL_ROW_RETENTION",
      "NO_NEW_PRIVACY_BOUNDARY",
      "NO_SILENT_ROW_OMISSION",
      "SEMANTIC_COMPATIBILITY_REMAINS_UNRESOLVED"
    ],
    "control_disposition": {
      "status_code": "PROPERTY_TYPE_NONCONFORMING_STOPPED",
      "reason_code": "PROPERTY_TYPE_STRUCTURAL_NONCONFORMANCE",
      "metadata_only": true,
      "retains_real_row_or_field_content": false,
      "row_specific_human_inspection": false
    },
    "source_continuation": {
      "continue_after_nonconforming_row": false,
      "later_rows_processed_after_trigger": false,
      "silent_row_skip_allowed": false,
      "silent_source_continuation_allowed": false
    },
    "persistence_boundary": {
      "may_persist_status_code": true,
      "may_persist_reason_code": true,
      "may_persist_exact_property_type": false,
      "may_persist_property_type_derivative": false,
      "may_persist_row_or_field_hash": false,
      "may_persist_exact_row_or_field_length": false,
      "may_persist_property_id": false,
      "may_persist_owner_holder_values": false,
      "may_persist_source_derived_free_text": false,
      "may_persist_real_row_or_field_content": false
    },
    "human_review_boundary": {
      "metadata_only_event_required_by_policy": false,
      "row_specific_human_inspection_authorized": false,
      "future_row_specific_inspection_requires_separate_privacy_authorization": true
    },
    "completeness_and_audit": {
      "continuation_enabled": false,
      "deferred_row_can_silently_disappear": false,
      "continuation_completeness_evidence_required_now": false,
      "future_continuation_requires_separate_completeness_audit_design": true,
      "future_continuation_identifiers_or_counters_require_privacy_review": true
    }
  },
  "alternatives_not_proposed_for_selection": [
    {
      "option_id": "ROW_LEVEL_METADATA_DEFER_WITH_OPTIONAL_LATER_CONTINUATION",
      "reason_not_proposed_now": "Would require a separately reviewed continuation policy and completeness/audit design before later rows could be processed."
    },
    {
      "option_id": "REAL_ROW_QUARANTINE",
      "reason_not_proposed_now": "Would introduce a new privacy and persistence boundary for real source content."
    },
    {
      "option_id": "HUMAN_REVIEW_ROUTE_METADATA_ONLY",
      "reason_not_proposed_now": "A metadata-only review cannot resolve the hidden token semantics and is not required to preserve the current fail-closed stop."
    }
  ],
  "selection_and_implementation_boundary": {
    "policy_proposed_for_human_review": true,
    "policy_selected_for_runtime": false,
    "policy_approved_for_runtime": false,
    "runtime_implementation_authorized": false,
    "real_source_validation_authorized": false,
    "source_continuation_authorized": false,
    "privacy_expansion_authorized": false,
    "real_row_quarantine_authorized": false,
    "row_specific_human_inspection_authorized": false,
    "source_activation_authorized": false,
    "production_classification_activation_authorized": false
  },
  "authorization_boundary": {
    "proposal_preparation_authorized": true,
    "source_or_authority_network_access_authorized": false,
    "real_source_execution_authorized": false,
    "runtime_code_change_authorized": false,
    "policy_runtime_selection_authorized": false,
    "privacy_expansion_authorized": false,
    "parser_change_authorized": false,
    "regex_change_authorized": false,
    "normalization_change_authorized": false,
    "remediation_authorized": false,
    "approval_token_defined_by_this_proposal": false
  },
  "implementation_state": {
    "proposal_branch": "m3-ca-sco-property-type-nonconforming-row-handling-policy-decision-proposal",
    "proposal_only": true,
    "source_request_performed": false,
    "authority_request_performed": false,
    "real_row_access_performed": false,
    "runtime_code_modified": false,
    "runner_modified": false,
    "parser_modified": false,
    "regex_modified": false,
    "normalization_modified": false,
    "logging_modified": false,
    "persistence_modified": false,
    "source_policy_modified": false,
    "registry_modified": false
  },
  "consumed_authorizations_remain_non_reusable": true,
  "safety_state": {
    "source_policy_status": "PROPOSED",
    "registry_enabled": false,
    "registry_approved_for_use": false,
    "approved_real_sources": 0,
    "authority_provenance_resolved": true,
    "semantic_compatibility_resolved": false,
    "production_classification_active": false,
    "downstream_gates_remain_closed": true
  },
  "acceptance_criteria": [
    "PROPOSAL_VALIDATES_AGAINST_VERSIONED_SCHEMA",
    "BASE_PINNED_TO_CI_GREEN_HANDLING_PROPOSAL_REVIEW",
    "T1_THROUGH_T6_ARE_EXPLICITLY_MACHINE_LOCKED",
    "ONE_POLICY_IS_PROPOSED_FOR_HUMAN_REVIEW_BUT_NOT_SELECTED_OR_AUTHORIZED_FOR_RUNTIME",
    "CONTROL_DISPOSITION_AND_SOURCE_CONTINUATION_ARE_SEPARATE_AXES",
    "METADATA_ONLY_DISPOSITION_RETAINS_NO_REAL_ROW_OR_FIELD_CONTENT",
    "SOURCE_CONTINUATION_IS_FALSE",
    "NO_COMPLETENESS_GAP_CAN_BE_CREATED_BY_CONTINUATION_BECAUSE_CONTINUATION_IS_DISABLED",
    "FUTURE_CONTINUATION_REQUIRES_SEPARATE_COMPLETENESS_AND_PRIVACY_REVIEW",
    "UNCHANGED_REGEX_AND_NO_NORMALIZATION_REMAIN_MACHINE_LOCKED",
    "NO_SOURCE_OR_AUTHORITY_NETWORK_ACCESS_OR_REAL_ROW_ACCESS_DURING_PREPARATION",
    "NO_RUNTIME_POLICY_PARSER_REGEX_NORMALIZATION_LOGGING_PERSISTENCE_REGISTRY_OR_SOURCE_POLICY_CHANGE",
    "SOURCE_POLICY_REGISTRY_PRODUCTION_CLASSIFICATION_AND_DOWNSTREAM_GATES_REMAIN_CLOSED"
  ],
  "next_gate": "HUMAN_PROPERTY_TYPE_NONCONFORMING_ROW_HANDLING_POLICY_DECISION_PROPOSAL_REVIEW"
}
